texto|Embedding1|Embedding2
"Para llegar al piso:
Desde el aeropuerto, se debe tomar 
la linea 8 de Metro (L8) y cambiar en la estacion 
""Nuevos Ministerios"" a (L6), y bajarse en la estacion 
""Lucero"".
"|[-0.008402058854699135, -0.013139181770384312, -0.011560141108930111, -0.03303639963269234, 0.007810730487108231, -0.004587667062878609, -0.011885046027600765, -0.02913753315806389, 0.008265597745776176, -0.008226609788835049, 0.01740194298326969, 0.02711012214422226, -0.019871225580573082, -0.011092276312410831, -0.015621460974216461, -0.0024757806677371264, -0.00582555728033185, 0.011040291748940945, 0.02508271113038063, -0.02592746540904045, -0.03155482932925224, -0.00043090604594908655, 0.006952979601919651, -0.03407609835267067, -0.003915112465620041, 0.0025033976417034864, 0.008824435994029045, -0.01185255590826273, 0.014984645880758762, 0.0006335658836178482, 0.02467982843518257, 0.011267725378274918, -0.0020728977397084236, -0.008577507920563221, -0.014425807632505894, -0.01709003373980522, 0.005812561139464378, -0.01449078880250454, 0.01239839754998684, 0.004343987908214331, 0.012742796912789345, -0.011410684324800968, 0.0024709070567041636, -0.002191488165408373, 0.0017658618744462729, -0.00014905043644830585, -0.004867085721343756, -0.009883628226816654, -0.022041594609618187, 0.014451800845563412, -0.030307192355394363, 0.014971649274230003, -0.03995038941502571, -0.01842864416539669, 0.007537809666246176, -0.014568766579031944, -0.007277884986251593, 0.002792563522234559, 0.00462990440428257, -0.023900054395198822, -0.020780961960554123, -0.030463147908449173, -0.04657846316695213, 0.023718107491731644, -0.003937855828553438, 0.01696007139980793, -0.007284383289515972, -0.01133920531719923, -0.010033084079623222, 0.0011794072343036532, 0.011937031522393227, 0.01971527189016342, 0.030411163344979286, -0.0303591787815094, 0.025875480845570564, 0.02005317248404026, 0.0032360595650970936, 0.0031759520061314106, 0.0036584369372576475, -0.005178994964808226, 0.02270440198481083, -0.0029241503216326237, -0.03527174890041351, 0.012846766971051693, 0.024887768551707268, -0.013918955810368061, -0.00810314528644085, 0.016596177592873573, -0.0256415493786335, -0.001185905421152711, -0.009792654775083065, 0.013028713874518871, 0.013308132998645306, 0.005149753764271736, -0.01087134052067995, 0.013197665102779865, 0.001996544888243079, 0.02448488585650921, 0.0023539410904049873, -0.012268435209989548, -0.0039118630811572075, -0.001941310940310359, -0.042497649788856506, 0.004880081862211227, -0.011592631228268147, -0.020066168159246445, 0.01048145443201065, 0.010546435602009296, 0.01867557317018509, -0.020975904539227486, -0.007739251013845205, 0.009311794303357601, 0.01354206446558237, -0.016479210928082466, 0.015504494309425354, -0.022730395197868347, 0.010591922327876091, 0.0030573615804314613, -0.021534742787480354, 0.003440750064328313, 0.006836013402789831, 0.020417066290974617, -0.0030898521654307842, -0.010656903497874737, 0.02002718113362789, -0.016544193029403687, 0.013840978033840656, -0.011469167657196522, -0.038182903081178665, 0.008538519032299519, -0.0052472250536084175, 0.01207349169999361, 0.008265597745776176, 0.007609288673847914, 0.018389657139778137, 0.004834595136344433, -0.026122409850358963, 0.033842165023088455, -0.005682598799467087, -0.017570894211530685, 0.009448254480957985, 0.0028071843553334475, -0.03467392548918724, -0.012255438603460789, 0.01655718870460987, 0.029475435614585876, -0.015231573954224586, -0.029995283111929893, 0.015361536294221878, 0.011150759644806385, 0.04629254713654518, -0.05775521695613861, -0.005955519620329142, -0.004789108410477638, 0.0111377639696002, 0.018597595393657684, 0.001062441268004477, 0.016284268349409103, -0.006673560943454504, 0.02588847652077675, -0.0032003200612962246, -0.010085069574415684, 0.015881385654211044, 0.006429881788790226, 0.022106576710939407, 0.03449197858572006, 0.0059392740949988365, -0.00491907075047493, -0.013080699369311333, 0.015322547405958176, 0.009981099516153336, -0.004041825421154499, -0.018974486738443375, 0.018597595393657684, 0.036467403173446655, 0.010689393617212772, 4.229483693052316e-06, -0.008259099908173084, -0.008382564410567284, 0.004954810254275799, -0.0007334743859246373, -0.00571508938446641, 0.011248231865465641, 0.024731812998652458, -0.035219766199588776, -0.0016342750750482082, 0.012456879951059818, 0.021560734137892723, 0.0017561146523803473, 0.019936207681894302, -0.01472472120076418, 0.021508749574422836, 0.03963848203420639, -0.0033026651944965124, -0.639622151851654, -0.013698019087314606, -0.0039995876140892506, -0.002881912514567375, 0.001065690303221345, 0.005705342162400484, -0.0002394148032180965, 0.012437385506927967, -0.010819355957210064, -0.05988659709692001, -0.015010638162493706, -0.014581763185560703, -0.006618326995521784, -0.004733874462544918, 0.0019656787626445293, -0.031502846628427505, -0.008830933831632137, 0.011696601286530495, 0.012794782407581806, 0.012060495093464851, -0.014971649274230003, 0.017219996079802513, -0.010663401335477829, 0.03826088085770607, 0.009376775473356247, 0.006150462664663792, 0.03906664624810219, -0.016531195491552353, 0.006589085329324007, -0.004090561531484127, -0.014217868447303772, 0.005380436312407255, 0.026590272784233093, -0.02033909037709236, 0.03982042893767357, -0.011774578131735325, -0.010858344845473766, 0.01718100719153881, 0.015842396765947342, 0.03220464289188385, 0.0014994392404332757, -0.009708179160952568, 0.04026230052113533, -0.02944944240152836, 0.01864957995712757, -0.009324789978563786, 0.0382348895072937, -0.020845942199230194, 0.027032144367694855, -0.010078571736812592, 0.016102321445941925, -0.011891544796526432, -0.011904540471732616, 0.01013705413788557, -0.009350783191621304, 0.015621460974216461, 0.037715040147304535, -0.01593337021768093, -0.004551927093416452, -0.009019379504024982, -0.004529183730483055, -0.004516187589615583, -0.024744808673858643, -0.010500948876142502, -0.004824847914278507, 0.01718100719153881, -0.032724492251873016, 0.013451091013848782, 0.014451800845563412, -0.0025001484900712967, -0.012749295681715012, 0.02895558625459671, -0.0035642143338918686, 0.033374302089214325, 0.010767371393740177, 0.007524813525378704, 0.012521861121058464, -0.0182986818253994, -0.0014011553721502423, 0.020287103950977325, 0.0037883990444242954, 0.010507446713745594, -0.024082001298666, 0.0029030314180999994, 0.003249055938795209, 4.883736983174458e-05, -0.0365973636507988, -0.012365906499326229, 0.021560734137892723, 0.004750119522213936, -0.013438095338642597, 0.018415648490190506, -0.021196840330958366, 4.419223478180356e-05, -0.0010413223644718528, -0.015049627050757408, -0.014464796520769596, 0.008460541255772114, 0.04478498548269272, -0.019819241017103195, 0.01355506107211113, -0.019351376220583916, -0.0034147577825933695, 0.007004964631050825, 0.03841683641076088, 0.004561674315482378, -0.0340501070022583, 0.0055396403186023235, 0.026291359215974808, -0.006576089188456535, -0.01664816215634346, 0.02626536786556244, 0.005679349880665541, -0.025511587038636208, 0.004779361188411713, -0.02911153994500637, 0.014867679215967655, 0.014919664710760117, 0.014672736637294292, -0.006244685500860214, -0.01377599686384201, 0.00013849099923390895, 0.002340944716706872, -0.011202744208276272, -0.011170254088938236, 0.005188742186874151, 0.01633625291287899, -0.019546320661902428, 0.00011452921899035573, -0.02098890021443367, -0.008629492484033108, 0.0071869115345180035, 0.011456171050667763, 0.006654066499322653, 0.062277901917696, 0.0002650011156219989, 0.022782379761338234, -0.02011815458536148, 0.018194712698459625, -0.017219996079802513, -0.0340501070022583, -0.014152887277305126, 0.0069464812986552715, -0.0003535378782544285, 0.018506621941924095, -0.04756617918610573, -0.00048086026799865067, 0.0056598554365336895, -0.04101607948541641, -0.005178994964808226, -0.02866966836154461, -0.04223772510886192, -0.023263240233063698, 0.026278363540768623, 0.005237477831542492, -0.0019916712772101164, -0.021716689690947533, 0.00442846305668354, -0.026447314769029617, -0.017752841114997864, -0.0012297676876187325, 0.014217868447303772, -0.0209629088640213, 0.010273514315485954, -0.00855801347643137, -0.013288638554513454, 0.005672851577401161, 0.03501182422041893, 0.006234938278794289, -0.020222123712301254, -0.006374647840857506, -0.006065987516194582, 0.004798855632543564, 0.023432191461324692, 0.010474955663084984, -0.018389657139778137, 0.0082461042329669, -0.005390183534473181, -0.007089439779520035, -0.003489485941827297, 0.01898748241364956, 0.018350668251514435, -0.01798677258193493, 0.0006161022465676069, -0.0041165538132190704, -0.000371610774891451, 0.02848772145807743, 0.01677812449634075, -0.015231573954224586, 0.004139297176152468, -0.006699553225189447, 0.0022694654762744904, 0.0016610798193141818, 0.0034115086309611797, 0.027941880747675896, 0.029371464625000954, 0.0032474312465637922, -0.01689509116113186, -0.005042534787207842, 0.009955107234418392, 0.02517368458211422, -0.014165883883833885, -0.0029338975436985493, -0.01929939165711403, 0.000463396601844579, -0.0277339406311512, 0.007563801947981119, -0.01929939165711403, 0.016609173268079758, 0.018259694799780846, 0.04169188439846039, -0.058638960123062134, -0.015751423314213753, -0.008733462542295456, -0.0005084772710688412, 0.014672736637294292, 0.0055363913998007774, 0.010637409053742886, -0.012333416379988194, -0.00014742590428795666, -0.02757798694074154, 0.0209629088640213, 0.032906439155340195, 0.006056240294128656, -0.022912342101335526, 0.008571009151637554, 0.023731103166937828, 0.01896148920059204, 0.027214091271162033, -0.008298088796436787, -0.01311968732625246, -0.020884931087493896, 0.003492735093459487, 0.01150815561413765, 0.016362246125936508, -0.016882093623280525, 0.014464796520769596, -0.013840978033840656, 0.007596292532980442, -0.013412103056907654, -0.0036974255926907063, 0.021534742787480354, 0.013373114168643951, -0.026434319093823433, 0.018038759008049965, -0.007570300251245499, 0.02708412893116474, 0.014334834180772305, -0.0071154325269162655, 0.002820180496200919, -0.013607045635581017, -0.011976019479334354, 0.0028429238591343164, -0.017219996079802513, -0.004480448085814714, -0.014763710089027882, -0.0007184474961832166, 0.004418715834617615, 0.022821368649601936, 0.014074910432100296, 0.01720700040459633, -0.0017382449004799128, 0.02248346619307995, 0.021092871204018593, 0.0017983524594455957, -0.01820770837366581, 0.0046396516263484955, -0.003707172814756632, 0.004093810450285673, -0.004103557672351599, -0.006277176085859537, 0.00460066320374608, 0.013529068790376186, -0.013477083295583725, 0.014828691259026527, -0.01026051864027977, -0.01238540094345808, -0.02677221968770027, 0.020754968747496605, 0.021664705127477646, 0.004292002879083157, 0.003963848110288382, 0.03095700405538082, 0.028721654787659645, 0.002732455963268876, -0.0068750022910535336, -0.01549149863421917, 0.012606336735188961, -0.024848779663443565, 0.001702505280263722, -0.0008061719709075987, 0.009285802021622658, -0.005282965023070574, 0.0082461042329669, -0.026096416637301445, -0.017700856551527977, 0.02820180542767048, 0.008395560085773468, 0.018818531185388565, -0.031814754009246826, -0.01664816215634346, -0.014061913825571537, -0.02399102784693241, -0.04613659158349037, 0.03714320808649063, 0.01258684229105711, -0.0082461042329669, -0.0104619599878788, 0.030749063938856125, -0.02441990375518799, -0.012157967314124107, -0.0008126700995489955, -0.028591692447662354, -0.014828691259026527, -0.01503663044422865, 0.005627364851534367, -0.031008988618850708, -0.021352795884013176, 0.02973535843193531, -0.004668893292546272, -0.009695182554423809, -0.028929593041539192, 0.004389474634081125, -0.017622878775000572, 0.03425804525613785, 0.004587667062878609, -0.008421552367508411, -0.0025797502603381872, 0.00985763594508171, 0.004672142211347818, -0.037741031497716904, -0.006361651234328747, -0.005292712245136499, 0.007661273702979088, -0.032308612018823624, -0.007277884986251593, 0.026902182027697563, -0.03342628851532936, 0.016765128821134567, -0.009571718983352184, -0.0020875183399766684, 0.007732753176242113, 0.006920489016920328, -0.004343987908214331, -0.005919779650866985, -0.017038049176335335, 0.003310787957161665, 0.021937625482678413, -0.0034764898009598255, 0.005679349880665541, 0.02405600994825363, -0.0025440107565373182, 0.01141718216240406, -0.014672736637294292, 0.02308129332959652, 0.0076742698438465595, 0.0028412993997335434, 0.030437154695391655, -0.013905959203839302, -0.002496899338439107, 0.0005608682986348867, -0.015595467761158943, 0.006033496931195259, 0.007791236042976379, 0.0030167484655976295, 0.008239605464041233, -0.00033018531394191086, -0.0023799333721399307, 0.03758507966995239, 0.0032734237611293793, -0.01355506107211113, 0.000674585229717195, -0.014555769972503185, 0.0028023107443004847, -0.0012744421837851405, -0.0025261410046368837, -0.029241502285003662, -0.0024709070567041636, 0.00014214619295671582, 0.01758388988673687, 0.02283436432480812, -0.001392220496200025, -0.028097834438085556, 0.01611531712114811, -0.00020215219410602003, -0.00929229985922575, 0.011319710873067379, -0.00866848137229681, -0.012203454039990902, -0.029787344858050346, -0.0041685388423502445, 0.016102321445941925, -0.030151238664984703, -0.01346408762037754, 0.0014848185237497091, -0.023510167375206947, -0.01408790610730648, 0.01230742409825325, 0.005656606052070856, 0.029085548594594002, 0.01920841820538044, 0.0004430899862200022, -0.008817937225103378, 0.02882562391459942, -0.006520855240523815, -0.011222238652408123, 0.009643197990953922, 0.0024644089862704277, 0.016011347994208336, 0.027188099920749664, 0.027967872098088264, -0.012021507136523724, -0.039898406714200974, 0.018727557733654976, 0.0002619551378302276, -0.003612950211390853, 0.01929939165711403, 0.0031727030873298645, -0.025524582713842392, 0.002919276710599661, -0.021560734137892723, 0.003463493660092354, -0.01789579913020134, -0.009136345237493515, -0.013737007975578308, -0.034907855093479156, 0.011794072575867176, -0.009961605072021484, 0.005334949586540461, 0.007771741598844528, 0.010578925721347332, 0.007485824637115002, -0.02107987366616726, 0.024523872882127762, -0.00270159007050097, -0.010637409053742886, 0.005198489408940077, -0.0069074928760528564, -0.028903601691126823, 0.0099486093968153, 0.007563801947981119, 0.02755199372768402, 0.014828691259026527, -0.00312396720983088, 0.01971527189016342, -0.02267841063439846, 0.012411393225193024, 0.04075615853071213, 0.009363778866827488, 0.016375241801142693, -0.00019210042955819517, -0.023406198248267174, -0.024718817323446274, 0.017505912110209465, 0.0182986818253994, 0.027681956067681313, 0.014802698977291584, 0.0008601875160820782, -0.03516777977347374, 0.0007350989035330713, -0.016791120171546936, -0.004753368906676769, -0.011696601286530495, 0.0008325705421157181, -0.04335540160536766, 0.008486533537507057, 0.009175334125757217, -0.003622697200626135, -0.024380914866924286, -0.01920841820538044, -0.0069074928760528564, 0.030593110248446465, -0.017232991755008698, 0.02321125566959381, 0.018571604043245316, 0.040990088135004044, -0.0188315287232399, -0.03428403660655022, 0.010344994254410267, 0.008863423950970173, 0.0028055596631020308, -0.017194002866744995, -0.005500651430338621, 0.027500009164214134, 0.02633034810423851, 0.013373114168643951, 0.02970936708152294, -0.0015522364992648363, -0.009019379504024982, 0.00877894926816225, -0.009597711265087128, 0.004909323528409004, -0.03147685155272484, 0.046838387846946716, 0.02043006382882595, 0.019403360784053802, -0.017232991755008698, -0.016921082511544228, 0.004272508434951305, 0.015439513139426708, -0.02661626599729061, 0.013931951485574245, 0.00937027670443058, -0.015946365892887115, -0.0023295730352401733, -0.007752247154712677, -0.00704395305365324, 0.006624824833124876, -0.01271030679345131, -0.03576560690999031, 0.017258984968066216, -0.03129490464925766, 0.013918955810368061, -0.0132301552221179, 0.03703923523426056, -0.00758329639211297, 0.019351376220583916, 0.01026051864027977, -0.007960187271237373, 0.005188742186874151, -0.0010096441255882382, -0.021716689690947533, 0.0033497766125947237, 0.0030557371210306883, -0.0025651296600699425, -0.013438095338642597, -0.016609173268079758, 0.005861296784132719, 0.0006185389938764274, 0.00991611834615469, 0.04075615853071213, -0.002365312771871686, -0.0028104332741349936, -0.01867557317018509, -0.016479210928082466, -0.051335081458091736, -0.0009146092343144119, -0.01992321014404297, 0.023601142689585686, 0.02898157760500908, 0.008096647448837757, 0.016973067075014114, -0.027681956067681313, -0.026902182027697563, 0.013724012300372124, -0.0162062905728817, 0.018012765794992447, -0.013360117562115192, 0.028409743681550026, 0.0314248688519001, -0.0024140484165400267, -0.01958530955016613, 0.041561923921108246, 0.008739960379898548, -0.002664225874468684, -0.004558425396680832, 0.023718107491731644, 0.007316873874515295, 0.0016334628453478217, -0.008928405120968819, 0.012105981819331646, 0.0052959611639380455, -0.02817581221461296, 0.00951323565095663, 0.0005052281776443124, 0.003889119951054454, -0.026161398738622665, -0.011943529359996319, -0.0008861799724400043, 0.012105981819331646, -0.008233107626438141, 0.005555885378271341, -0.0164922084659338, -0.009032375179231167]|[-0.017609883099794388, 0.016635166481137276, -0.020157143473625183, 0.018350668251514435, 0.003242557868361473, -0.004399221856147051, 0.0016813863767310977, -0.023315224796533585, -0.017375951632857323, -0.0098251448944211, 0.01238540094345808, 0.013879966922104359, -0.00758329639211297, 0.031658802181482315, 0.005650108214467764, 0.0007513441960327327, 0.0017219996079802513, 0.022353503853082657, 0.017570894211530685, 0.015192585065960884, -0.020196130499243736, -0.0004223772557452321, -0.0099486093968153, -0.02379608526825905, 0.015231573954224586, -0.01586838811635971, 0.005412926897406578, -0.0026561031118035316, -9.234425670001656e-05, -0.026824206113815308, 0.0008764328085817397, 0.005481157451868057, -0.014841686934232712, -0.020248116925358772, -0.003622697200626135, -0.027006153017282486, -0.0037851501256227493, 0.0036584369372576475, 0.017752841114997864, 0.03852080553770065, 0.013633038848638535, -0.012002012692391872, -0.03189273178577423, 0.007908201776444912, 0.0010185790015384555, 0.0002623612526804209, 0.0027779426891356707, 0.03701324388384819, -0.017661867663264275, 0.008928405120968819, -0.01880553551018238, -0.006978971883654594, -0.010396978817880154, 0.0001241748541360721, 0.0026236125268042088, -0.031684793531894684, 0.03472590819001198, -0.00602699862793088, -0.004214025568217039, -0.014477793127298355, -0.005312206223607063, 0.017388947308063507, -0.004054821562021971, -0.01293124258518219, 0.010247522033751011, 0.011488661170005798, -0.0061829532496631145, -0.025472598150372505, -0.006978971883654594, 0.024315934628248215, -0.035713620483875275, 0.014165883883833885, 0.02532964013516903, -0.02386106550693512, 0.020183134824037552, 0.033998120576143265, -0.013983936049044132, 0.02661626599729061, -0.03810492902994156, -0.0056111193262040615, 0.004506440367549658, 0.0007428153767250478, -0.019884221255779266, -0.011547144502401352, -0.031528837978839874, -0.023783089593052864, -0.031034981831908226, 0.014685732312500477, 0.02143077179789543, -0.01400992926210165, 0.013106691651046276, 0.026746228337287903, 0.0036974255926907063, 0.0005494965589605272, -0.030255207791924477, -0.0006226003170013428, 0.01709003373980522, -5.386325574363582e-05, -0.02114485576748848, -0.03888469934463501, -0.005237477831542492, 0.03371220454573631, 0.013568057678639889, -0.03488186374306679, -0.006176455412060022, -0.024120990186929703, -0.022288523614406586, 0.015595467761158943, -0.001198089332319796, 0.007518315222114325, 0.013386109843850136, 0.011014299467206001, -0.004382976330816746, -0.004389474634081125, 0.013269144110381603, 0.026980159804224968, -0.02592746540904045, -0.010104564018547535, 0.013054706156253815, -0.01122873742133379, 0.0033562746830284595, -0.014815694652497768, -0.026291359215974808, 0.02430293709039688, -0.002457910683006048, 0.008038164116442204, 0.021599723026156425, 0.03485587239265442, -0.03394613415002823, -0.032282620668411255, -0.003158082254230976, 0.012716804631054401, -0.010033084079623222, 0.004616908263415098, -0.01077386923134327, -0.011748585850000381, -0.024601850658655167, 0.006553345825523138, -0.004555176477879286, 0.004610410425812006, 0.023419193923473358, 0.0016505203675478697, 0.0015408647013828158, 0.025381624698638916, -0.01068289577960968, -1.227914708579192e-05, 0.01577741466462612, -0.015010638162493706, 0.030541125684976578, 0.031346891075372696, -0.006900994572788477, 0.014113898389041424, -8.846061973599717e-06, 0.004870334640145302, -0.017284976318478584, 0.012944238260388374, -0.01796078123152256, 0.00358045962639153, 0.01773984543979168, -0.010754374787211418, -0.0028916597366333008, -0.01280777808278799, 0.02185964770615101, -0.03467392548918724, 0.006524104159325361, 0.009578216820955276, -0.01880553551018238, -0.011846058070659637, 0.011677106842398643, 0.017168011516332626, -0.028929593041539192, -0.0021801164839416742, 0.008369567804038525, 0.008051160722970963, -0.0009137969464063644, -0.025186680257320404, 0.02036508172750473, -0.005360942333936691, 0.013840978033840656, -0.016817113384604454, -0.014464796520769596, -0.00457467045634985, -0.0030931010842323303, 0.007999175228178501, 0.016674155369400978, 0.015374531969428062, 0.19827038049697876, 0.0014978147810325027, -0.0013767874334007502, 0.04634453356266022, -0.002764946548268199, 0.019130440428853035, 0.005263470578938723, 0.009552224539220333, -0.011709596961736679, -0.0022613429464399815, -0.03358224034309387, -0.0008780573261901736, 0.0063389078713953495, 0.006589085329324007, -0.0023523163981735706, -0.025446604937314987, -0.030125245451927185, -0.03891069442033768, -0.01580340787768364, -0.013002721592783928, 0.011898042634129524, -0.005949021317064762, 0.01355506107211113, -0.006998466327786446, 0.0017512411577627063, 0.009675688110291958, -0.03966447338461876, -0.0003184074885211885, 0.0665406659245491, 0.004019082058221102, 0.007219402119517326, -0.0010876214364543557, -0.015335544012486935, 0.0005507149617187679, -0.006592334248125553, 0.012404895387589931, 0.011956525966525078, -0.019091451540589333, -0.00034988269908353686, 0.046396516263484955, 0.007875711657106876, -0.0011720969341695309, -0.03950851783156395, -0.007011462468653917, -0.021651707589626312, 0.012002012692391872, -0.014607755467295647, -0.0003171890857629478, 0.007810730487108231, 0.007895206101238728, -0.03158082440495491, -0.010254019871354103, -0.018610592931509018, 0.02074197307229042, 0.0019396863644942641, 0.0042887539602816105, 0.033530257642269135, -0.007953688502311707, 0.004607161041349173, 0.024939753115177155, -0.011391189880669117, 0.02479679509997368, -0.013191167265176773, 0.006283673923462629, 0.0162452794611454, -0.017934788018465042, -0.004298500716686249, -0.015842396765947342, 0.019533323124051094, 0.0008943026186898351, 0.016674155369400978, 0.011989016085863113, -0.005978262983262539, 0.01608932390809059, -0.02495274879038334, -0.020715979859232903, 0.042341697961091995, 0.004097059369087219, 0.0300732608884573, 0.02477080188691616, -0.007940692827105522, -0.014113898389041424, 0.007596292532980442, 0.016596177592873573, 0.022535450756549835, -0.009779658168554306, -0.004330991301685572, 0.0037331650964915752, -0.02639533020555973, -0.014763710089027882, 0.016843104735016823, -0.033686209470033646, 0.004711131099611521, 0.0233022291213274, 0.0020420316141098738, 0.034777894616127014, 0.022002605721354485, 0.024224961176514626, -0.022535450756549835, 0.017349958419799805, -0.029943298548460007, 0.0017967278836295009, 0.004327742382884026, 0.002760072937235236, -0.00224509765394032, 0.03327033296227455, 0.003765655681490898, 0.017817823216319084, 0.008005673997104168, -0.002123258076608181, 0.0071154325269162655, -0.022847360000014305, 0.016466215252876282, -0.015595467761158943, 0.022509459406137466, -0.01936437375843525, 0.02354915626347065, -0.016752131283283234, -0.004824847914278507, 0.003398512490093708, 0.020910924300551414, -0.0027438276447355747, -0.010708888061344624, 0.00591003242880106, 0.013028713874518871, -0.010319001041352749, -0.013158676214516163, 0.008473537862300873, 0.0027405787259340286, -0.019637294113636017, -0.0029046558775007725, -0.024445896968245506, 0.011599129065871239, -0.0015327420551329851, 0.00539668183773756, -0.004581168759614229, 0.008863423950970173, -0.0006940795574337244, -0.02139178477227688, -0.02085893787443638, -0.004376478027552366, -0.00963670015335083, 0.007895206101238728, -0.01802576147019863, -0.010130556300282478, 0.015309550799429417, 0.009467748925089836, 0.01516659278422594, -0.03579159826040268, 0.013659031130373478, -0.037715040147304535, -0.0033562746830284595, 0.01311968732625246, -0.022041594609618187, 0.032932430505752563, 0.0014360826462507248, -0.023536160588264465, -0.02130080945789814, 0.02526465803384781, 0.013282140716910362, 0.0020793958101421595, -0.025745518505573273, -6.65548795950599e-05, -0.0015814779326319695, -0.000925168686080724, -0.005884040147066116, -0.16354447603225708, 0.016531195491552353, 0.01196302380412817, -0.028383752331137657, -0.004516187589615583, -0.017778834328055382, 0.033062390983104706, -0.004941814113408327, -0.03410208970308304, 0.0033757691271603107, 0.0011006176937371492, 0.0064591229893267155, -0.02367911860346794, 0.012944238260388374, -0.012404895387589931, 0.016167301684617996, -0.013438095338642597, 0.0041198027320206165, 0.043589334934949875, 0.004191282205283642, 0.03636343404650688, -0.03301040828227997, 0.016479210928082466, -0.0043179951608181, -0.001187529880553484, 1.826324842113536e-05, -0.019104449078440666, 0.005705342162400484, 0.001107115764170885, -0.026590272784233093, -0.04200379550457001, 0.007076443638652563, 0.01227493304759264, 0.011989016085863113, 0.028149820864200592, 0.023380206897854805, 0.010838850401341915, 0.022951330989599228, -0.004421965219080448, 0.01842864416539669, 0.0015108109218999743, -0.0029875067993998528, 0.02217155694961548, 0.02289934642612934, 0.001972176833078265, 0.045148879289627075, -0.008239605464041233, 0.004402470774948597, -0.00021545302297454327, 0.003772153751924634, 0.010689393617212772, -0.015192585065960884, 0.005520145874470472, -0.003197070909664035, 0.018935497850179672, -0.007180413696914911, -0.008590503595769405, -0.005292712245136499, 0.01992321014404297, -0.021885640919208527, 0.010513944551348686, -0.004369980189949274, -0.007778239902108908, -0.01696007139980793, -0.016297264024615288, 0.002644731430336833, -0.0017479920061305165, 0.007024458609521389, -0.027603978291153908, -0.002090767491608858, 0.005117263179272413, -0.012944238260388374, 0.019780252128839493, -0.0073948511853814125, 0.01324315182864666, 0.01693408004939556, -0.00898039061576128, 0.0066670626401901245, 0.005916530732065439, -0.0014393317978829145, -0.010396978817880154, 0.06628073751926422, -0.013983936049044132, 0.007719756569713354, -0.008655484765768051, 0.0034245047718286514, -0.00883743166923523, -0.005822307895869017, -0.007986179552972317, -0.017843814566731453, 0.02167770080268383, 0.0010080195497721434, -0.018038759008049965, -0.030541125684976578, 0.026746228337287903, 0.023185262456536293, 0.01547850202769041, -0.0196502897888422, -0.010455462150275707, -0.010598420165479183, 0.00312396720983088, -0.0013946571853011847, -0.03729915991425514, 0.0041555422358214855, 0.015465506352484226, 0.037169199436903, 0.003976844251155853, 0.037091221660375595, 0.011163756251335144, -0.012554352171719074, 0.013633038848638535, -8.01603018771857e-05, -0.004880081862211227, 0.028097834438085556, 0.01718100719153881, -0.00043943480704911053, 0.0043959724716842175, -0.027162106707692146, 0.015621460974216461, 0.002311703283339739, 0.00938327331095934, -0.029319480061531067, -0.013801989145576954, 0.008609998039901257, -0.011995513923466206, -0.014932660385966301, -0.07106334716081619, -0.0217426810413599, 0.026564281433820724, 0.011501657776534557, -0.023133277893066406, 0.01417887955904007, -0.0032977918162941933, -0.001946184434928, 0.011371695436537266, 0.004886580165475607, -0.0026057427749037743, -0.0444730781018734, 0.025628551840782166, 0.016544193029403687, 0.03488186374306679, -0.008571009151637554, -0.004295251797884703, -0.015153596177697182, 0.02495274879038334, 0.0043244934640824795, -0.005585127044469118, 0.00983814150094986, 0.02423795685172081, -0.007914700545370579, -0.019221413880586624, -0.015569475479424, -0.013360117562115192, 0.005269968416541815, 0.02152174524962902, -0.0002335258905077353, 0.02664225734770298, -0.003980093635618687, 0.009357281029224396, -0.0104619599878788, 0.0037201689556241035, 0.00026561031700111926, 0.005741081666201353, 0.01705104485154152, -0.004646149929612875, -0.027526000514626503, -0.004506440367549658, -0.006712549366056919, -0.030931012704968452, -0.03080105036497116, 0.003518727608025074, -0.01564745232462883, 0.002095641102641821, -0.0022353504318743944, -0.01271030679345131, -0.017843814566731453, -0.022574439644813538, 0.004577919840812683, -0.042991507798433304, -0.03532373532652855, 0.007336368318647146, 0.005078274291008711, -0.007342866156250238, 0.014958653599023819, 0.006491613574326038, -0.02786390297114849, -0.007680768147110939, -0.007349364459514618, -0.0065468475222587585, -0.00015321328828576952, 0.012177461758255959, 0.008057658560574055, -0.03969046473503113, -0.00545841408893466, 0.005861296784132719, 0.0024855276569724083, -0.0015416770474985242, -0.019754258915781975, -0.02414698339998722, 0.020378079265356064, -0.04631854221224785, 0.00724539440125227, -0.006637820973992348, -0.008752956055104733, 0.012736299075186253, -0.031190935522317886, -0.022223541513085365, -0.030463147908449173, 0.012885755859315395, -0.00883743166923523, 0.013126186095178127, 0.051023174077272415, 0.021781669929623604, -0.00013970940199214965, 0.01736295409500599, 0.005565632600337267, 0.005809311755001545, 0.007622285280376673, 0.015439513139426708, -0.028773639351129532, 0.007089439779520035, 0.02183365635573864, 0.0034115086309611797, 0.007778239902108908, 0.00110874033998698, 0.012346412055194378, -0.047800108790397644, -0.017661867663264275, -0.08842630684375763, -0.004558425396680832, -0.00636490061879158, 0.013256147503852844, -0.003963848110288382, 0.00267397309653461, 0.004782610107213259, 0.025589564815163612, -0.00014732437557540834, -0.011007801629602909, -0.024601850658655167, -0.01896148920059204, 0.012573846615850925, 0.0006477804854512215, -0.009019379504024982, 0.01410090271383524, 0.0064591229893267155, 0.015023634769022465, -0.0013735383981838822, 0.021638711914420128, 0.005630613770335913, -0.015985354781150818, 0.001668390235863626, 0.01976725645363331, -0.039716459810733795, 0.0012898751301690936, 0.0025098957121372223, 0.00894789956510067, 0.0061439648270606995, -0.021248824894428253, 0.010767371393740177, -0.007654775399714708, -0.014997641555964947, 0.02770794928073883, 0.0010429469402879477, -0.04088611900806427, -0.028253789991140366, 0.008148632012307644, 0.010280013084411621, 0.04444708302617073, -0.009142843075096607, -0.01689509116113186, 0.010013590566813946, -0.008389062248170376, 0.017843814566731453, -0.03371220454573631, 0.03194471821188927, 0.0017853562021628022, 0.03301040828227997, 0.002368561690673232, -0.0008926781010814011, -0.004951561335474253, -0.007323371712118387, -0.02976135164499283, 0.02308129332959652, -0.012989724986255169, -0.002771444618701935, -0.00662157591432333, -0.01736295409500599, -0.04935965687036514, 0.02236650139093399, 0.0018064751056954265, 0.013165174052119255, 0.0032311859540641308, 0.022977322340011597, -0.023198258131742477, -0.011267725378274918, -0.002163871191442013, 0.00522448169067502, -0.033244337886571884, -0.023627134039998055, 0.026291359215974808, 0.015842396765947342, 0.013178170658648014, -0.013607045635581017, 0.021261822432279587, 0.00877894926816225, -0.002527765464037657, -0.008350073359906673, 0.012905250303447247, 0.014152887277305126, -0.009753665886819363, -0.0209239199757576, 0.015062622725963593, 0.006410387344658375, 0.021664705127477646, -0.0219896100461483, -0.007628783117979765, -0.00963670015335083, -0.006173206027597189, -0.016687151044607162, -0.010578925721347332, 0.002678846474736929, -0.0037883990444242954, -0.01182006485760212, -0.013957943767309189, 0.00015717308269813657, -0.016076328232884407, 0.004087312147021294, 0.014243860729038715, -0.0087594548240304, -0.00038866829709149897, -0.0015148723032325506, -0.03529774397611618, -0.021196840330958366, 0.009006382897496223, -0.02410799451172352, -0.016388237476348877, 0.03579159826040268, -0.005929526872932911, -0.016076328232884407, 0.015101611614227295, 0.010306005366146564, 0.007004964631050825, -0.01709003373980522, -0.005760576110333204, 0.030593110248446465, -0.019182424992322922, -0.026668250560760498, 0.019013475626707077, 0.02911153994500637, 0.027292069047689438, 0.0016326506156474352, 0.01289875153452158, 0.006439628545194864, 0.016102321445941925, 0.022756386548280716, -0.04304349049925804, 0.015569475479424, -0.013477083295583725, 0.005549387540668249, -0.0009674063767306507, -0.027292069047689438, -0.027785925194621086, 0.0007545932312496006, 0.01002658624202013, -0.0015952864196151495, -0.01714201830327511, 0.011241733096539974, 0.09071364253759384, 0.012456879951059818, -0.02848772145807743, -0.010273514315485954, -0.013126186095178127, 0.016102321445941925, -0.0001364603522233665, 0.0030248709954321384, -0.012144970707595348, -0.012131975032389164, -0.0006173205911181867, 0.021287813782691956, 0.020313097164034843, -0.021352795884013176, -0.01789579913020134, -0.00527971563860774, -0.03342628851532936, 0.01664816215634346, -0.014295846223831177, -0.0032945426646620035, 0.032282620668411255, -0.01111826952546835, -0.02570652961730957, 0.012599838897585869, -0.029683373868465424, 0.02517368458211422, 0.02098890021443367, 0.034777894616127014, -0.00018935903790406883, -0.003188948379829526, 0.01996219903230667, 0.00786921288818121, -0.012775287963449955, -0.016531195491552353, 0.018688568845391273, -0.00508477259427309, -0.004369980189949274, -0.017700856551527977, 0.026668250560760498, 0.023133277893066406, -0.008577507920563221, 0.026213383302092552, -0.013814985752105713, -0.040210314095020294, -0.00474687060341239, -0.022821368649601936, 0.008265597745776176, -0.030151238664984703, 0.008291590958833694]
