texto|Embedding1|Embedding2
"
La descripcion del piso: 
El departamento tiene puerta a la calle, y los ambientes 
garantizan tranquilidad, silencio y su buen descanso, 
haciendo que su estadia sea placentera, segura e inolvidable.
"|[0.008159023709595203, 0.022018618881702423, 0.006724400445818901, -0.02616449072957039, 0.008475019596517086, 0.02083047293126583, -0.006522162817418575, -0.012728329747915268, -0.01060483418405056, 0.001243445323780179, 0.0002601044252514839, 0.006288325879722834, -0.0024900506250560284, -0.006458963733166456, -0.002049235859885812, -0.013726877979934216, 0.013613118790090084, -0.016671963036060333, 0.012153216637670994, -0.012848407961428165, -0.010111880488693714, -0.01304432563483715, -0.023194124922156334, -0.012861047871410847, -0.008064224384725094, 0.01830250397324562, 0.019907765090465546, -0.015572295524179935, -0.0007816957659088075, -0.0003669506695587188, 0.018277224153280258, -0.015205739997327328, -0.01626748777925968, -0.021171750500798225, 0.012993765994906425, -0.02793407067656517, -0.005330856889486313, -0.022132378071546555, 0.0022103937808424234, 0.011590742506086826, 0.023484842851758003, -0.00656640250235796, 0.0021187548991292715, -0.012804168276488781, 0.016621403396129608, 0.007299513556063175, -0.0005016440409235656, 0.01366367843002081, -0.023687079548835754, 0.0008326501701958477, -0.00273494771681726, 0.03165018558502197, -0.014320950955152512, -0.0035075584892183542, 0.026341449469327927, -0.01289896760135889, -0.0065537625923752785, 0.012526092119514942, 0.003719276050105691, -0.03650388866662979, -0.01653292402625084, -0.026594245806336403, -0.04135759174823761, 0.003114143153652549, -0.03574549779295921, 0.023990435525774956, -0.006073448341339827, 0.004483987111598253, 0.013271843083202839, -0.005046460311859846, 0.03036092035472393, -0.017683150246739388, 0.001529421890154481, -0.001369053847156465, 0.02179110236465931, 0.0024742507375776768, 0.027099840342998505, 0.01586301252245903, -0.0005857780924998224, 0.025380820035934448, -0.0037729954347014427, -0.03066427819430828, -0.028186867013573647, 0.002794987056404352, 0.032737214118242264, 0.03253497555851936, 0.010541635565459728, 0.0022562132216989994, -0.02773183211684227, -0.002761807292699814, 0.0024916306138038635, 0.030411479994654655, 0.00043449486838653684, -0.011217867024242878, -0.02229669690132141, 0.014535828493535519, 0.008980614133179188, 0.021197030320763588, -0.002839226508513093, -0.011913059279322624, 0.006477923598140478, 0.0033084808383136988, -0.03531574085354805, 0.002976684831082821, -0.051317792385816574, -0.023219404742121696, 0.015445897355675697, 0.010756513103842735, 0.03336920589208603, 0.0016115809557959437, -0.022625332698225975, 0.012551371939480305, 0.003867794293910265, -0.026594245806336403, 0.00452506635338068, 0.009947562590241432, 0.011167308315634727, -0.014131353236734867, -0.03855154290795326, -0.01820138469338417, 0.005078060086816549, 0.008481339551508427, 0.00011681987234624103, -0.02598753198981285, -0.015066701918840408, -0.008019985631108284, 0.01976872608065605, -0.03387479856610298, -0.02324468456208706, 0.002799726789817214, -0.03963857144117355, 0.020185841247439384, 0.010491075925529003, -0.013347682543098927, -0.013486720621585846, -0.001057007466442883, -0.01927577145397663, 0.018428901210427284, 0.011856179684400558, -0.023585960268974304, 0.016115808859467506, 0.021816382184624672, -0.06158135086297989, -0.007381672505289316, 0.029324453324079514, 0.007514391094446182, -0.033040568232536316, -0.004920061677694321, 0.004171150736510754, 0.016874199733138084, 0.01357519906014204, -0.036048855632543564, -0.011540183797478676, 0.008190623484551907, -0.02277701161801815, 0.0037698354572057724, 0.01366367843002081, 0.022448373958468437, -0.01683628186583519, -0.015407977625727654, 0.037413958460092545, -0.00851293932646513, 0.000881629588548094, -0.009138612076640129, 0.02187958173453808, 0.018618499860167503, 0.009498847648501396, 0.005387736484408379, -0.021083271130919456, 0.0018074986292049289, 0.00034285595756955445, 0.005308737047016621, -0.014219831675291061, 0.018504740670323372, 0.01830250397324562, 0.015698693692684174, -0.0004641195118892938, -0.02316884696483612, -0.014106073416769505, -0.005270817782729864, -0.01405551377683878, -0.030285082757472992, -0.0016447606030851603, 0.035973016172647476, -0.023800838738679886, -0.0023589120246469975, 0.039562731981277466, 0.034405674785375595, 0.013790076598525047, 0.013954395428299904, 0.0032800412736833096, 0.02472354844212532, 0.026973441243171692, -0.017367154359817505, -0.6398798227310181, -0.0033274407032877207, -0.006673841271549463, -0.014801264740526676, 0.016861559823155403, 0.020160561427474022, 0.012677770107984543, 0.049295417964458466, 0.00033357355277985334, -0.05038244277238846, -0.0007358763250522316, -0.029602529481053352, 0.008803656324744225, -0.013613118790090084, -0.014358870685100555, -0.013196003623306751, -0.011078828945755959, 0.004667264875024557, 0.008550859056413174, 0.0035107184667140245, 0.002987744752317667, 0.026417287066578865, -0.01792330853641033, 0.013638398610055447, 0.014497908763587475, -0.005883850622922182, 0.028389103710651398, -0.018820738419890404, -0.02190486155450344, 0.028818858787417412, -0.03938577324151993, 0.003953113220632076, 0.008064224384725094, -0.004705184604972601, 0.052784014493227005, -0.015395337715744972, 0.0026496287900954485, 0.01415663305670023, 0.011932019144296646, 0.007899906486272812, 0.012045777402818203, -0.017063798382878304, 0.01597677171230316, -0.0038741142489016056, 0.02821214683353901, 0.008923734538257122, 0.06906414031982422, -0.027276797220110893, -0.007318473421037197, 0.0006023678579367697, 0.025810575112700462, -0.011527543887495995, -0.016027331352233887, 0.02742847613990307, 0.020666155964136124, -0.0019433770794421434, 0.04699496552348137, -0.02577265538275242, -0.007596550043672323, -0.007261594291776419, 0.02093159221112728, 0.0206155963242054, 0.005492015276104212, -0.013372962363064289, -0.02080519311130047, 0.03445623442530632, 0.017493553459644318, -0.004114271141588688, 0.01118626818060875, -0.011262106709182262, -0.023307884112000465, 0.01624220795929432, -0.021740542724728584, 0.017506193369627, 0.0262908898293972, -0.008576138876378536, 0.048006150871515274, -0.0038646343164145947, 0.0030778036452829838, 0.007906226441264153, 0.00678759953007102, 0.005166538991034031, -0.028060467913746834, -0.020476557314395905, 0.03238329663872719, -0.021740542724728584, -0.009631565771996975, -0.005751132033765316, 0.022751731798052788, -0.004101631697267294, 0.007969425991177559, 0.022069178521633148, 0.012127936817705631, -0.02957724966108799, -0.00813374388962984, -0.00036833315971307456, 0.017202837392687798, 0.030411479994654655, 0.006667521316558123, -0.01975608617067337, 0.0036971562076359987, -0.016090529039502144, 0.00836126133799553, 0.017253395169973373, 0.024053635075688362, -0.009549407288432121, -0.021272867918014526, -0.009694765321910381, 0.02305508777499199, 0.001965496689081192, -0.0008942694403231144, 0.016798362135887146, -0.007893586531281471, -0.02646784670650959, 0.006724400445818901, -0.027757111936807632, 0.025026904419064522, 0.019124094396829605, 0.014889744110405445, -0.0032895212061703205, -0.01585037261247635, -0.005090699996799231, -0.007817748002707958, -0.018353063613176346, 0.000950358749832958, 0.025140663608908653, 0.016419166699051857, 0.0030541038140654564, -0.02113383077085018, 0.007046716753393412, 0.01313280500471592, 0.002689128275960684, 0.013891195878386497, 0.005381416529417038, 0.031169870868325233, 0.009353489615023136, 0.015003502368927002, -0.022916048765182495, 0.02530498057603836, -0.01239969301968813, -0.015357417985796928, -0.014573747292160988, -0.013158084824681282, 0.00953676737844944, 0.006509522907435894, -0.025077464058995247, -0.005943889729678631, -0.001976556610316038, -0.03306584805250168, -0.01624220795929432, 0.005036980379372835, -0.05389632284641266, -0.04196430370211601, 0.04006832465529442, 0.03195354342460632, 0.0014764924999326468, -0.00967580545693636, -0.006098727695643902, -0.012330174446105957, 0.010345717892050743, 0.016103168949484825, 0.011129388585686684, -0.015723973512649536, -0.005362456664443016, -0.023585960268974304, 0.007040396798402071, 0.024066274985671043, 0.03716116026043892, 0.0045693060383200645, -0.04975045099854469, 0.010269878432154655, 0.01828986406326294, -0.0028423864860087633, 0.018820738419890404, 0.01567341387271881, 0.002439491217955947, -0.006743360310792923, -0.030487319454550743, 0.006598001811653376, -0.003513878444209695, 0.0045187463983893394, 0.006673841271549463, -0.0023589120246469975, -0.0054098558612167835, 0.03776787221431732, -0.0029387653339654207, 0.009246050380170345, 0.021171750500798225, -0.005217098165303469, 0.0028155266772955656, 0.02616449072957039, 0.00915125198662281, -0.01743035390973091, 0.013120165094733238, -0.022018618881702423, 0.025456659495830536, 0.02324468456208706, 0.008670937269926071, -0.011856179684400558, 0.006667521316558123, -0.005959689617156982, 0.005400375928729773, 0.03961329162120819, -0.011603382416069508, 0.009252370335161686, -0.026720644906163216, 0.008386541157960892, -0.013777436688542366, 0.037135880440473557, 0.008190623484551907, 0.02052711695432663, -0.02587377466261387, -0.015256299637258053, -0.008930054493248463, -0.001251345151104033, 0.0159514918923378, -0.017480913549661636, 0.030891794711351395, -0.013802716508507729, -0.001335084205493331, 0.0063294051215052605, 0.02286548912525177, 0.023876678198575974, 0.0010190879693254828, -0.02431907318532467, 0.0020018364302814007, -0.004003672860562801, -0.019541209563612938, 0.01869433932006359, -0.015723973512649536, -0.019490649923682213, -0.01352464035153389, 0.00374455563724041, 0.003227901877835393, -0.0196676068007946, 0.0054193357937037945, 0.010838671587407589, -0.031018193811178207, -0.003069903701543808, 0.00593440979719162, 0.006108207628130913, 0.02500162459909916, 0.017202837392687798, -0.03347032517194748, -0.023194124922156334, -0.007457511965185404, 0.017771629616618156, 0.02248629368841648, 0.011894099414348602, -0.013499360531568527, 0.0012331753969192505, -0.00671176053583622, -0.02013528160750866, 0.003943633288145065, 0.005201298277825117, -0.03218105807900429, 0.001451212796382606, -0.018340423703193665, 0.015584935434162617, 0.024761468172073364, 0.039461612701416016, 0.02334580384194851, 0.03938577324151993, 0.017670510336756706, -0.0015934112016111612, -0.0098338034003973, 0.007280554156750441, -0.038096509873867035, 0.007248954381793737, -0.006430523935705423, 0.02199333906173706, -0.003330600680783391, 0.008727816864848137, 0.0018438382539898157, -0.010130840353667736, -0.004291229415684938, -0.038475703448057175, -0.01898505538702011, 0.01483918447047472, -0.005763771943747997, 0.004152190871536732, -0.008380221202969551, 0.03074011579155922, 0.030209243297576904, 0.007836706936359406, 0.0008334401645697653, -0.016191648319363594, 0.009037492796778679, -0.019692886620759964, 0.027706552296876907, 0.0007737958803772926, -0.003003544406965375, -0.0067686401307582855, -0.00452190637588501, -0.001557861571200192, -0.01264617033302784, 0.03407703712582588, -0.008184303529560566, 0.00024746457347646356, -0.02715039812028408, -0.008633017539978027, -0.03005756437778473, -0.015104621648788452, -0.013802716508507729, 0.007109915837645531, 0.029653089120984077, -0.00370979611761868, -0.008689897134900093, -0.0006742570549249649, -0.02540609985589981, -0.004044752102345228, 0.006361004896461964, -0.013499360531568527, -0.002689128275960684, 0.017177557572722435, -0.011432744562625885, 0.0023446923587471247, -0.019048254936933517, 0.035973016172647476, -0.010010761208832264, -0.003924673423171043, -0.02187958173453808, 0.0018169785616919398, -0.0015278419014066458, 0.03885490074753761, 0.010630114004015923, 1.0529094652156346e-05, 0.00836126133799553, 0.0028044667560607195, -0.008955334313213825, 0.002412631409242749, -0.00037406058982014656, 0.0014772824943065643, -0.004872662480920553, -0.04259629547595978, -0.001643180614337325, 0.012728329747915268, 0.021765822544693947, 0.002450551139190793, 0.0002784717071335763, 0.003791955066844821, -0.029804768040776253, -0.0005877530784346163, -0.019301051273941994, -0.014965582638978958, -0.004082671832293272, 0.011015629395842552, 0.028161587193608284, -0.009631565771996975, 0.00773558858782053, 0.026594245806336403, -0.013714238069951534, 0.019402170553803444, -0.0048947823233902454, 0.02228405699133873, 0.005975489504635334, 0.026897601783275604, -0.00632624514400959, -0.03675668686628342, 0.018530020490288734, -0.009479887783527374, -0.005833290982991457, 0.0048063029535114765, 0.008544539101421833, 0.03258553519845009, 0.013410881161689758, 0.019730806350708008, -0.03579605743288994, 0.0073500731959939, -0.007476471830159426, 0.0026211889926344156, 0.020590316504240036, -0.002395251765847206, -0.0006999316974543035, 0.006591681856662035, -0.004313348792493343, -0.006035528611391783, -0.0045882659032940865, 0.012203775346279144, -0.0032247419003397226, 0.02803518809378147, -0.004051072057336569, -0.011432744562625885, -0.0019022974884137511, -0.001159706269390881, -0.0221702978014946, -0.00273494771681726, -0.011464344337582588, -0.017670510336756706, -0.03139738738536835, 0.0035486379638314247, 0.009315569885075092, -0.03807123005390167, -0.0047336239367723465, -0.005055940244346857, -0.008323341608047485, -0.048612866550683975, 0.0005853830953128636, 0.02793407067656517, 0.013019045814871788, 0.014965582638978958, -0.0049485014751553535, -0.021462466567754745, 0.04747527837753296, -0.016848919913172722, -0.020577676594257355, -0.003292681183665991, -0.012096337042748928, 0.001409343327395618, 0.00773558858782053, 0.02636672742664814, -0.019831925630569458, -0.017442993819713593, -1.4577796719095204e-05, 0.022637972608208656, -0.012576651759445667, 0.014169272035360336, 0.008936374448239803, -0.01984456554055214, -0.005166538991034031, 0.005062260199338198, 0.0025658896192908287, -0.0007761658052913845, -0.025911694392561913, 0.028060467913746834, -0.023573322221636772, 0.006263046059757471, -0.007861986756324768, 0.02218293771147728, -0.015926212072372437, -0.016962679103016853, 0.01343616098165512, -0.0062377662397921085, 0.02851550281047821, 0.012993765994906425, -0.0005968379555270076, 2.3884873371571302e-05, -0.016520284116268158, -0.0131454449146986, 0.033697839826345444, 0.0021076949778944254, -0.002485310658812523, 0.01415663305670023, -0.017645230516791344, 0.010250918567180634, -0.020413357764482498, 0.017493553459644318, 0.043076612055301666, 0.01810026541352272, -0.012810488231480122, 0.030891794711351395, -0.009119652211666107, -0.008569818921387196, 0.006831839215010405, 0.006436843890696764, 0.020552396774291992, 0.0014259330928325653, -0.01566077396273613, -0.017746349796652794, 0.004828422795981169, -0.015104621648788452, 0.0010427876841276884, -0.0069329580292105675, -0.005375096574425697, -0.020653516054153442, -0.003330600680783391, -0.008304381743073463, 0.005384576506912708, -0.017076438292860985, -0.03425399586558342, -0.024445470422506332, -0.00861405860632658, 0.00515705905854702, 0.0513683520257473, 0.004534546285867691, 0.0016921600326895714, -0.018466820940375328, -0.0019307371694594622, -0.002260953187942505, 0.005833290982991457, -0.012829448096454144, -0.03718644008040428, 0.0037350759375840425, 0.028667181730270386, 0.024938425049185753, 0.011830899864435196, 0.014738066121935844, 0.012159536592662334, 0.011514903977513313, 0.004626185167580843, -0.027883511036634445, 0.010579555295407772, -0.029324453324079514, 0.04113007336854935, 0.032155778259038925, 0.01828986406326294, 0.028186867013573647, -0.012052097357809544, -0.016191648319363594, 0.005899650044739246, -0.014561108313500881, 0.017354514449834824, -0.015003502368927002, -0.010358357802033424, 0.00022968978737480938, -0.019440090283751488, -0.0014314630534499884, 0.014371509663760662, -0.012658810243010521, -0.014194551855325699, 0.00117313617374748, -0.02364915981888771, 0.011432744562625885, 5.179376239539124e-05, 0.015054062008857727, -0.009176531806588173, 0.0319029837846756, 0.02559569664299488, 0.013259203173220158, 0.011527543887495995, -0.011021949350833893, -0.0317007452249527, -0.01653292402625084, 0.037894271314144135, 0.011451704427599907, -0.00046648949501104653, -0.009347169660031796, -0.02482466585934162, 0.004762063734233379, 0.017278674989938736, 0.021639423444867134, -0.0034538391046226025, 0.007406952325254679, -0.006171407178044319, -0.03470902889966965, -0.04181262478232384, -0.01187513954937458, -0.047146644443273544, 0.007798787672072649, -0.006623281631618738, -0.01587565243244171, 0.017442993819713593, -0.0209189523011446, 8.640522719360888e-05, -0.0211211908608675, 0.005713212303817272, 0.016406526789069176, 0.004348108544945717, 0.01701323874294758, 0.004458707291632891, 0.004202750511467457, -0.013082245364785194, 0.024887865409255028, -0.005915449932217598, -0.02841438353061676, 0.029046377167105675, -0.010446836240589619, -0.006114527583122253, -0.0042817494831979275, -0.006490563042461872, 0.012595610693097115, 0.0023889318108558655, -0.011919379234313965, 0.01732923462986946, -0.002022376051172614, -0.0027807671576738358, -0.02023640088737011, 0.02258741296827793, 0.013360322453081608, 0.015787173062562943, -0.011028269305825233, 0.015167820267379284, -0.005024340469390154, -0.0033274407032877207]|[-0.02694816142320633, 0.012235375121235847, -0.02170262299478054, 0.023484842851758003, 0.0010783371981233358, -0.019730806350708008, -0.00018712904420681298, -0.021917501464486122, -0.021968061104416847, -0.011350586079061031, 0.01634332723915577, 0.004556666128337383, -0.01288632769137621, -0.007836706936359406, 0.02452130988240242, 0.027024000883102417, -0.0038551543839275837, 0.01483918447047472, 0.02161414362490177, 0.019199933856725693, -0.005994448903948069, -0.021778462454676628, 0.010990350507199764, 0.0018691179575398564, 0.012564011849462986, -0.023724999278783798, -0.02102007158100605, -0.027175677940249443, -0.011736101470887661, -0.014194551855325699, -0.007406952325254679, 0.024205313995480537, -0.01751883327960968, 0.0039151934906840324, 0.0064716036431491375, -0.033798959106206894, -0.00939772929996252, 0.011426424607634544, 0.016368607059121132, 0.05374464392662048, 0.004575625993311405, -0.01895977556705475, -0.01626748777925968, -0.0034190795850008726, 0.00942932814359665, 0.012564011849462986, 0.011325306259095669, 0.01664668321609497, -0.0181129053235054, 0.01645708456635475, -0.01099666953086853, -0.01837834343314171, -0.022840209305286407, -0.0009938082657754421, -0.002717567840591073, -0.02335844375193119, 0.021373987197875977, -0.002392091788351536, -0.02530498057603836, -0.011356906034052372, -0.012968487106263638, -0.008234862238168716, -0.02636672742664814, -0.003833034774288535, 0.013688958249986172, 0.0110851489007473, 0.0029545649886131287, -0.015218379907310009, -0.0022498934995383024, 0.016216928139328957, -0.012772569432854652, 0.010510035790503025, 0.020956872031092644, -0.016495004296302795, 0.011597062461078167, 0.013474080711603165, -0.01769579015672207, -0.0055710142478346825, -0.03395063802599907, -0.022789649665355682, -0.01935161091387272, -0.01226065494120121, -0.025140663608908653, -0.02032488025724888, -0.015483817085623741, -0.001948116929270327, -0.02005944214761257, 0.02725151740014553, 0.00477154366672039, -0.013512000441551208, 0.02433171309530735, 0.022056538611650467, -0.01186881959438324, 0.003050943836569786, -0.012273294851183891, -0.019326331093907356, -0.00413639098405838, -0.020261680707335472, -0.024685628712177277, -0.033141687512397766, -0.005236058030277491, 0.03218105807900429, 0.03948689252138138, -0.025747375562787056, 0.013701598159968853, 0.02715039812028408, -0.02035016007721424, 0.015547016635537148, -0.012418652884662151, 0.016318047419190407, 0.01497822254896164, -0.002708087908104062, 0.0015270519070327282, 0.0065348027274012566, 0.029021097347140312, 0.02022376097738743, -0.007786147762089968, -0.015572295524179935, 0.0008753096335567534, -0.006901358254253864, 0.020375439897179604, -0.013903835788369179, -0.03205466270446777, -0.002475830726325512, 0.010592195205390453, 0.010920831002295017, 0.017164917662739754, 0.023901958018541336, -0.012437612749636173, -0.014270391315221786, 0.0003714931081049144, 0.01459902711212635, -0.0046514649875462055, 0.008620377629995346, 0.007944146171212196, -0.007236314471811056, -0.016848919913172722, 0.012829448096454144, 0.013246563263237476, 0.006541122682392597, 0.010661713778972626, 0.003877274226397276, -0.013512000441551208, -0.0020729354582726955, -0.018416263163089752, -0.006221966352313757, 0.011148348450660706, -0.0028360665310174227, 0.009271330200135708, 0.015028782188892365, -0.029172774404287338, 0.032636094838380814, -0.018643779680132866, -0.015458537265658379, -0.025722095742821693, 0.0006525322678498924, -0.037413958460092545, 0.0032674013637006283, 0.01420719176530838, 0.008045264519751072, -0.016785722225904465, -0.013372962363064289, 0.033343926072120667, -0.0254819393157959, -0.03523990511894226, 0.011919379234313965, 0.0045693060383200645, 0.006945597939193249, 0.0057985312305390835, 0.043733883649110794, -0.02090631239116192, 0.00915125198662281, -0.020375439897179604, 0.008727816864848137, -0.0032026220578700304, -0.019427450373768806, 0.0047336239367723465, -0.00865197740495205, -0.013840636238455772, 0.005324536934494972, -0.015483817085623741, -0.00328636122867465, 0.008873174898326397, -0.017544113099575043, -0.008917414583265781, 0.008778376504778862, 0.21154053509235382, 0.00012234979658387601, -0.004575625993311405, 0.013827996328473091, -0.00765974959358573, 0.04611017554998398, 0.0034980785567313433, 0.005741652101278305, -0.00593440979719162, 0.02745375595986843, -0.01947801001369953, 0.00773558858782053, 0.046261854469776154, 0.005431975703686476, 0.004736783914268017, -0.03756563737988472, -0.018744898959994316, -0.023472202941775322, -0.02199333906173706, -0.01887129619717598, -0.011609702371060848, -0.023295244202017784, -0.0015855112578719854, -0.004471347201615572, 0.010743873193860054, 0.020944232121109962, -0.01606524921953678, -0.013537280261516571, 0.033141687512397766, 0.015256299637258053, -0.0016384406480938196, 0.005507814697921276, 0.0157492533326149, -0.00671176053583622, -0.01965496689081192, -0.010737553238868713, 0.005166538991034031, -0.038981299847364426, 0.026493126526474953, 0.017379794269800186, -0.015900932252407074, -0.01701323874294758, -0.010263558477163315, -0.019882485270500183, -0.004869502503424883, 0.030765395611524582, -0.02763071283698082, -0.00016994673933368176, 0.034582629799842834, -0.00561525346711278, 0.004882142413407564, -0.011369545944035053, 0.019718166440725327, 0.011881459504365921, -0.0027317877393215895, -0.01925049163401127, 0.025026904419064522, 0.01406815368682146, 0.0024710907600820065, -0.011274746619164944, 0.004009992815554142, -0.002088735345751047, -0.025153303518891335, 0.027706552296876907, 0.00827278196811676, 0.0027807671576738358, -0.004149030894041061, 0.01420719176530838, 0.03948689252138138, -0.021626783534884453, 0.012633530423045158, 0.006774960085749626, -0.018239304423332214, -0.00021882740838918835, -0.03122043050825596, -0.0038172348868101835, 0.024774106219410896, 0.020110001787543297, 0.03842514753341675, 0.02687232196331024, -0.005138099193572998, 0.005981809459626675, -0.020299600437283516, 0.0007828807574696839, 0.021652063354849815, -0.027554873377084732, 0.0012695150217041373, -0.00328320125117898, 0.004439747426658869, -0.01523101981729269, -0.0052550178952515125, -0.017885388806462288, 0.012861047871410847, -0.0017142797587439418, 0.03968913108110428, 0.01712699793279171, 0.011710821650922298, 0.017784269526600838, -0.03349560499191284, -0.013992314226925373, -0.021184390410780907, -0.0005766931571997702, 0.01840362325310707, 0.005011700559407473, -0.02803518809378147, 0.010598515160381794, -0.009069092571735382, 0.008057904429733753, 0.0038172348868101835, -0.0010238279355689883, 0.016950039193034172, -0.014813904650509357, -0.008936374448239803, -0.027200957760214806, 0.015395337715744972, -0.004727303981781006, 0.019515929743647575, -0.014384149573743343, -0.01635596714913845, -0.009182851761579514, -0.005852250847965479, -0.0017964387079700828, -0.008386541157960892, 0.0025722095742821693, 0.009195491671562195, 0.0012292254250496626, -0.02110855095088482, 0.02042599767446518, 0.013992314226925373, -0.03453207015991211, 0.02588641457259655, 0.013840636238455772, 0.009998122230172157, -0.0034759589470922947, 0.008424459956586361, 0.0492701381444931, -0.004009992815554142, 0.009650525636970997, -0.018744898959994316, -0.009859083220362663, 0.008873174898326397, -0.025469299405813217, 0.02395251765847206, -0.001687420066446066, -0.007963106036186218, 0.003643436823040247, 0.0007469361880794168, -0.020994791761040688, -0.027125120162963867, 0.00020421258523128927, 0.0005470685428008437, -0.008702537044882774, -0.0178095493465662, -0.013967035338282585, 0.015091981738805771, 0.00600708881393075, -0.01713963784277439, -0.016419166699051857, -0.016570843756198883, 0.016811002045869827, -0.02296660840511322, -0.01606524921953678, 0.01163498219102621, 0.02296660840511322, -0.00406687194481492, 0.008241182193160057, -0.15703749656677246, 0.019098814576864243, 0.015407977625727654, -0.03569493815302849, -0.005801691208034754, 0.009176531806588173, 0.004404988139867783, 0.022220857441425323, -0.02404099516570568, -0.007470151875168085, -0.0011778760235756636, -0.006547442637383938, -0.014965582638978958, 0.013954395428299904, -0.013600478880107403, 0.014396789483726025, -0.020299600437283516, 0.0023620720021426678, 0.022713812068104744, 0.007413272280246019, 0.0214245468378067, -0.048309508711099625, 0.007021436933428049, -0.010743873193860054, 0.010415236465632915, -0.018353063613176346, 0.007918866351246834, 0.013322402723133564, -0.009840123355388641, -0.00865197740495205, -0.014851824380457401, 0.023181485012173653, 0.04206542298197746, 0.010370997712016106, 0.027175677940249443, -0.0025911694392561913, 0.0226758923381567, 0.005703732371330261, -0.004022632259875536, 0.025722095742821693, -0.00020855753973592073, 0.0022783330641686916, -0.0011652362300083041, 0.010914511047303677, 0.005198138765990734, 0.02190486155450344, -0.006926638074219227, -0.004088991787284613, -0.0025011105462908745, -0.01692475937306881, -0.008317021653056145, -0.027226237580180168, -0.012709369882941246, 0.017935948446393013, 0.009195491671562195, 0.010029721073806286, -0.008089504204690456, 0.0087530966848135, 0.015129901468753815, -0.02811102755367756, -0.016495004296302795, 0.00154601177200675, -0.020021522417664528, -0.029653089120984077, 0.01763259246945381, -0.021449826657772064, 0.0010277777910232544, 0.0007133615436032414, -0.00430386932566762, 0.0009290290181525052, -0.0006197476759552956, -0.0160526093095541, 0.008430779911577702, -0.010484755970537663, 0.004332308657467365, -0.0039151934906840324, -0.013726877979934216, -0.00367187662050128, -0.002576949540525675, -0.001948116929270327, -0.02793407067656517, 0.026038091629743576, -0.03845042362809181, -0.018251944333314896, -0.025936974212527275, 0.007931506261229515, -0.005163379013538361, -0.013967035338282585, -0.007204714696854353, 0.006806559395045042, 0.027580153197050095, -3.8512043829541653e-05, -0.009720045141875744, -0.03357144445180893, 0.006781280040740967, 0.020577676594257355, 0.0160526093095541, 0.006440003868192434, -0.019541209563612938, -0.011445384472608566, 0.017379794269800186, -0.011849859729409218, -0.02742847613990307, -0.010092920623719692, 0.026998721063137054, 0.005826971028000116, -0.006067128386348486, 0.018441541120409966, 0.0027681272476911545, -0.024205313995480537, 0.015888292342424393, 0.002606969093903899, -0.0007271863869391382, 0.027782391756772995, -0.014915023930370808, 0.016709882766008377, -0.009707405231893063, -0.007792467717081308, 0.026594245806336403, -0.014459989033639431, 0.03432983532547951, -0.004720984026789665, -0.008089504204690456, 0.02100743167102337, 0.0160526093095541, -0.006895038299262524, -0.08787224441766739, -0.006161927245557308, 0.027782391756772995, -0.006863438989967108, -0.012595610693097115, 0.0022198737133294344, -0.019326331093907356, 0.020173201337456703, 0.020666155964136124, -0.009751644916832447, -0.0029087455477565527, -0.021487746387720108, -0.009751644916832447, -0.005754292011260986, 0.02694816142320633, -0.027858231216669083, -0.010857631452381611, -0.007122555747628212, -0.02062823623418808, -0.0034443591721355915, -0.012418652884662151, -0.007432232145220041, -0.004670424852520227, -0.0027144078630954027, -0.03195354342460632, 0.01792330853641033, -0.024559229612350464, 0.01908617466688156, 0.006964557804167271, 0.01624220795929432, 0.012658810243010521, 0.00982748344540596, 0.00014446953719016165, -0.0030477838590741158, 0.02569681592285633, -0.012722009792923927, 0.011894099414348602, -0.003946793265640736, 0.04044752195477486, -0.005681612994521856, 0.01585037261247635, 0.007969425991177559, 0.005204458255320787, -0.01926313154399395, 0.022258777171373367, -0.0019496969180181623, -0.010269878432154655, -0.0003120463225059211, -0.02393987774848938, -0.016330687329173088, -0.016002051532268524, 0.00316154258325696, -0.014106073416769505, -0.033798959106206894, 0.02053975686430931, -0.0010175079805776477, -0.007716628722846508, 0.011325306259095669, -0.01289264764636755, -0.005672133062034845, -0.009599966928362846, 0.0007378512527793646, 0.00406687194481492, 0.016684602946043015, 0.004945341497659683, -0.0014448929578065872, -0.03941105306148529, -0.004939021542668343, 0.029602529481053352, -0.005962849594652653, -0.0017142797587439418, -0.0034538391046226025, -0.0032610814087092876, 0.014915023930370808, -0.03496182709932327, -0.0003240936785005033, -0.01828986406326294, 0.003940473310649395, -0.006598001811653376, -0.024483390152454376, -0.030183963477611542, -0.014674866572022438, 0.008057904429733753, -0.011047229170799255, 0.014030233956873417, 0.025911694392561913, 0.026240330189466476, 0.013271843083202839, 0.026695365086197853, 0.015028782188892365, -0.020489197224378586, 0.01006764080375433, 0.005896490067243576, -0.018062345683574677, -0.012842088006436825, 0.004487147089093924, 0.011274746619164944, -0.006070288363844156, 0.004218549933284521, 0.007520711049437523, -0.04798087105154991, -0.017392434179782867, -0.0698225349187851, 0.012532412074506283, 0.00328320125117898, 0.011792980134487152, 3.0291204893728718e-05, 0.0033148007933050394, -0.002393671777099371, 0.016381246969103813, 0.0030003844294697046, -0.0023715519346296787, -0.015483817085623741, -0.0038425144739449024, 0.025279700756072998, -0.004098471719771624, -0.04274797439575195, -0.02375027909874916, -0.00967580545693636, 0.019503289833664894, 0.006259886082261801, 0.005763771943747997, -0.016671963036060333, -0.0018501580925658345, -0.002986164763569832, 0.005059100221842527, -0.02800990827381611, 0.007868306711316109, -0.036908362060785294, 0.006831839215010405, -0.013233923353254795, -0.022347256541252136, 0.012848407961428165, -0.015938851982355118, -0.0012173756258562207, 0.03607413172721863, -0.005659493152052164, -0.024104194715619087, 0.007716628722846508, 0.01225433498620987, 0.016659323126077652, 0.007963106036186218, -0.017860108986496925, -0.02813630737364292, 0.02618977054953575, -0.04037168249487877, 0.00261328904889524, 0.0034159196075052023, 0.0037161160726100206, -0.011786661110818386, 0.027554873377084732, 0.010927150957286358, 0.018504740670323372, 0.016671963036060333, -0.002941925311461091, -0.0003628031990956515, -0.00023600971326231956, -0.016393886879086494, 0.023017168045043945, -0.020299600437283516, -0.013929115608334541, -0.010250918567180634, 0.040523361414670944, 0.007969425991177559, 0.011401144787669182, -0.008778376504778862, 0.027858231216669083, 0.009808523580431938, -0.036908362060785294, 0.0006592472200281918, 0.013094885274767876, -0.023724999278783798, -0.026619525626301765, -0.0007299513672478497, 0.02927389368414879, 0.001938637113198638, 0.0037603555247187614, 7.46541190892458e-05, 0.01606524921953678, -0.019124094396829605, -0.022056538611650467, 0.015281579457223415, 0.03139738738536835, 0.011255786754190922, -0.008177983574569225, 0.019022975116968155, 0.028667181730270386, 0.035770777612924576, -0.020969511941075325, -0.00749543122947216, 0.01908617466688156, 0.0005849880981259048, -0.022145017981529236, 0.004477667156606913, 0.004414467606693506, 0.014915023930370808, 0.010819711722433567, -0.0079757459461689, 0.004619865212589502, -0.024887865409255028, 0.019414810463786125, 0.040826715528964996, 0.004619865212589502, 0.020362799987196922, -0.006086088251322508, -0.018643779680132866, -0.02276437170803547, -0.012443932704627514, -0.036048855632543564, -0.02326996438205242, 0.004799983464181423, 0.01753147318959236, 0.0319029837846756, 0.006610641721636057, -0.00851293932646513, 0.009498847648501396, -0.017455633729696274, 0.006070288363844156, 0.01099666953086853, -0.0159514918923378, -0.016280127689242363, 0.025254420936107635, 0.009808523580431938, 0.03895602002739906, -0.016204288229346275, 0.0006655671168118715, -0.0056531731970608234, -0.013322402723133564, -0.002050815848633647, -0.02424323372542858, 0.04080143943428993, -0.00788726657629013, -0.011129388585686684, 0.00469886464998126, -0.011287386529147625, -0.004976941272616386, -0.022612692788243294, 0.011932019144296646, 0.005150739103555679, 0.005523614585399628, 0.014535828493535519, 0.08271518349647522, 0.04653992876410484, -0.013992314226925373, 0.007634469773620367, -0.012759929522871971, -0.01770843006670475, 0.005299257580190897, 0.013562560081481934, -0.001186565961688757, -0.015686053782701492, 0.03865266218781471, 0.009739005006849766, 0.009321889840066433, -0.019831925630569458, -0.022005978971719742, -0.009732685051858425, -0.012955847196280956, 0.0073943124152719975, -0.01740507408976555, 0.00363711710087955, 0.014851824380457401, 0.004670424852520227, -0.015483817085623741, -0.0005048040184192359, -0.05652541294693947, -0.014877104200422764, 0.020097361877560616, 0.015382697805762291, -0.010636433959007263, -0.022397814318537712, 0.01682364195585251, 0.0008366000838577747, -0.03599829599261284, -0.015648135915398598, -0.002791827078908682, -0.004645145032554865, -0.009271330200135708, -0.004114271141588688, -0.0026749083772301674, 0.023990435525774956, 1.1121587704110425e-05, 0.019692886620759964, -0.028464943170547485, -0.024394910782575607, 0.01616636849939823, 0.02003416232764721, -0.0021566743962466717, -0.027757111936807632, -0.018416263163089752]
